Title,Short Description,Location,Price,Timestamp,Size
10 Marla Brand New Park View House Available For Sale,10 Marla Brand New Park View House ,"Royal Orchard, Multan Public School Road",3.15 Crore,Added: 10 hours ago,10 Marla
08 Marla Luxury Double Storey House Available For Sale Dha Multan Sector V.,08 Marla Luxury double Storey House,"DHA Phase 1, DHA Defence",2.25 Crore,Added: 2 days ago,8 Marla
Prime Location,The House is designed and developed,"Buch Executive Villas, Multan",2.35 Crore,Added: 2 days ago,7.5 Marla
Prime Location,Here is the House you can have toda,"Buch Executive Villas, Multan",2.7 Crore,Added: 2 days ago,10 Marla
Prime Location,The best feature of the House is it,"Buch Executive Villas, Multan",2.3 Crore,Added: 2 days ago,7.5 Marla
"Property For sale In Khan Village Khan Village Is Available Under Rs. 30,000,000",Main boliverd By choosing this Hous,"Khan Village, Multan",3 Crore,Added: 7 hours ago,12 Marla
9 Marla Prime Location Spanish House Available For Sale,9 Marla Newly Built Spanish Villa A,"Buch Executive Villas - Phase 2, Buch Executive Villas",3.2 Crore,Added: 8 hours ago,9 Marla
End Your Search For House Here And sale Now,"""10 Marla Villas
SALIENT FINISHING ","Royal Orchard - Block C, Royal Orchard",2.8 Crore,Added: 1 day ago,10 Marla
Flat On 5th For Sale In Business Hub,The first multi-purpose mega mall o,"Business Hub, DHA Defence",1.07 Crore,Added: 4 days ago,4.2 Marla
5 MARLA HOUSE AVAILABLE FOR SALE,5 Marla House For sale in Buch at o,"Buch Executive Villas, Multan",1.35 Crore,Added: 6 days ago,5 Marla
7 Marla Brand New House For Sale,This House will help you make the b,"Wapda Town Phase 2, Wapda Town",1.95 Crore,Added: 10 hours ago,7 Marla
10 Marla Brand New House Available For Sale on 60ft Facing Road,10 Marla Brand New House Available ,"Wapda Town Phase 2, Wapda Town",3.25 Crore,Added: 10 hours ago,10 Marla
Buying A House In Multan Public School Road?,5 Marla double story house at dream,"Multan Public School Road, Multan",1 Crore,Added: 16 minutes ago,5 Marla
House Of 6.5 Marla In Multan Public School Road For sale,6.5 Marla single story house at dre,"Multan Public School Road, Multan",1.1 Crore,Added: 16 minutes ago,6.5 Marla
7Marla Brand new House available for sale in wapda town phase 1,WAPDA Town Multan is Situated on th,"Wapda Town Phase 1, Wapda Town",2.17 Crore,Added: 8 hours ago,7 Marla
7.5 Marla House available for sale in Buch Villas Bosan Road Multan,"""Buch Executive Villas"" is a projec","Buch Executive Villas - Phase 2, Buch Executive Villas",2.12 Crore,Added: 8 hours ago,7.5 Marla
7Marla Brand New House available for sale in Buch Villas,"""Buch Executive Villas"" is a projec","Buch Executive Villas - Phase 1, Buch Executive Villas",2.37 Crore,Added: 8 hours ago,7 Marla
Prime Location,The spacious and centrally located ,"Askari 3, DHA Defence",2.5 Crore,Added: 23 minutes ago,12 Marla
Prime Location,You cannot find a better deal than ,"DHA Villas, DHA Defence",2.65 Crore,Added: 23 minutes ago,12 Marla
Prime Location,The House is smartly designed to ha,"DHA Villas, DHA Defence",2.2 Crore,Added: 23 minutes ago,9 Marla
Prime Location,Live in a House that compliments yo,"DHA Villas, DHA Defence",1.4 Crore,Added: 23 minutes ago,6 Marla
Prime Location,The House is constructed with moder,"DHA Villas, DHA Defence",2.55 Crore,Added: 25 minutes ago,12 Marla
12 Marla Askari 3 House For Sale DHA Multan,Brand New House for Sale DHA Multan,"Askari 3, DHA Defence",2.3 Crore,Added: 4 hours ago,12 Marla
"A House In Multan DHA Villas
12 Marla",You can book your House today at an,"DHA Villas, DHA Defence",2.35 Crore,Added: 4 hours ago,12 Marla
7 Marla House for Sale Wada town phase 1 Block E,WAPDA Town Phase 1 Block E; 7Marla ,"Wapda Town Phase 1 - Block E, Wapda Town Phase 1",2.15 Crore,Added: 4 hours ago,7 Marla
